{
  "$schema": "https://json-schema.org/draft/2020-12/schema",
  "additionalProperties": true,
  "properties": {
    "adapter_capability_hashes": {},
    "adapter_conformance_status": {},
    "adapter_count": {},
    "failures": {},
    "schema_version": {},
    "verification_status": {},
    "warnings": {}
  },
  "required": [
    "schema_version",
    "adapter_conformance_status",
    "verification_status",
    "adapter_count",
    "adapter_capability_hashes",
    "failures",
    "warnings"
  ],
  "schema_version": 1,
  "type": "object"
}
